"WYZE Cam Pan v3 Indoor/Outdoor IP65-Rated 1080p Pan/Tilt/Zoom Wi-Fi Smart Home Security Camera with Color Night Vision, 2-Way Audio, Works with Alexa & Google Assistant, White",3.6,39.97
"WYZE Cam v3 with Color Night Vision, Wired 1080p HD Indoor/Outdoor Video Camera, 2-Way Audio, Works with Alexa, Google Assistant, and IFTTT",4.5,35.98
"Kasa Indoor Pan/Tilt Smart Security Camera, 1080p HD Dog Camera 2.4GHz with Night Vision, Motion Detection for Baby and Pet Monitor, Cloud & SD Card Storage, Works with Alexa & Google Home (EC70)",4.4,29.99
"Google Nest Cam Outdoor or Indoor, Battery - 2nd Generation - 2 Count (Pack of 1)",4.4,239.98
"FLIPPER Zero, (FLP-Z-W-R04)",4.3,391.50
"Security Cameras Wireless Outdoor, 1080P Battery Powered AI Motion Detection Spotlight Siren Alarm WiFi Surveillance Indoor Home Camera, Color Night Vision, 2-Way Talk, Waterproof, Cloud/SD Storage",4.8,47.99
"Wyze Cam v3 with Color Night Vision, Wired 1080p HD Indoor/Outdoor Security Camera, 2-Way Audio, Works with Alexa, Google Assistant, and IFTTT, 2-Pack",4.5,70.96
Google Nest Security Cam (Wired) - 2nd Generation - Snow,4.5,79.99
"Wyze Cam v2 1080p Pan/Tilt/Zoom Wi-Fi Indoor Smart Home Camera with Color Night Vision, 2-Way Audio, Compatible with Alexa & The Google Assistant, White",4.5,49.98
"Arlo Essential Spotlight Camera - 1 Pack - Wireless Security, 1080p Video, Color Night Vision, 2 Way Audio, Wire-Free, Direct to WiFi No Hub Needed, Works with Alexa, White - VMC2030",4.1,84.12
"Wyze Cam Floodlight with 2600 Lumen LEDs, Wired 1080p HD IP65 Outdoor Smart Security Camera, Color Night Vision, 270-Degree Customizable Motion Detection, 105dB Siren, and Two-Way Audio",4.4,82.34
"YI 4pc Security Home Camera, 1080p 2.4G WiFi Smart Indoor Nanny IP Cam with Night Vision, 2-Way Audio, AI Human Detection, Phone App, Pet Cat Dog Cam - Works with Alexa and Google",4.3,89.99
"WiFi Camera 2K, Galayou Indoor Home Security Cameras for Baby/Elder/Dog/Pet Camera with Phone app,24/7 SD Card Storage,Works with Alexa & Google Home G7",4.6,24.99
"Small Wireless WiFi Camera Hidden Spy Security Cameras,Mini Nanny Cam Smart Home Cams Pet Dog Camera Indoor Outdoor Baby Camera 1080P Remote Portable Camera Phone APP Room Camera",2.7,19.99
"REOLINK Security Camera Wireless Outdoor, Pan Tilt Solar Powered with 2K Night Vision, 2.4/5 GHz Wi-Fi, 2-Way Talk, Works with Alexa/ Google Assistant for Home Surveillance, Argus PT w/ Solar Panel",4.3,135.99
eMACROS 1/2 Mile Long Range Solar Wireless Driveway Alarm Outdoor Weather Resistant Motion Sensor & Detector-Security Alert System-Monitor & Protect Outside Property,4.4,59.99
"Kasa Smart Security Camera for Baby monitor, 1080p HD Indoor Camera for Home Security with Motion Detection, Two-Way Audio, Night Vision, Cloud & SD Card Storage, Works with Alexa & Google Home (EC60)",4.3,22.99
"Kasa 4MP 2K Security Camera Outdoor Wired, IP65, Starlight Sensor & 98 Ft Night Vision, Motion/Person Detection, 2-Way Audio w/Siren, Cloud/SD Card Storage, Alexa &Google Assistant Compatible(KC420WS)",4.4,44.99
"Wyze Cam v3 1080p HD Indoor/Outdoor Security Camera with Color Night Vision, 2-Way Audio, Compatible with Alexa & The Google Assistant and IFTTT with Wyze Cam Plus A.I. 3 Month Detection Service",4.4,41.95
256GB Blink USB Flash Drive for Local Video Storage with The Blink Sync Module 2 Mount (Blink Add-On Sync Module 2 is NOT Included),4.5,23.99
"Vimtag Mini G3 Security Camera Outdoor/Indoor with Spotlight, Plug-in HD Full-Color Night Vision Home Cam with AI Human Detection, Weather-Resistant, Cloud/SD Card Storage, Support Alexa & 2.4Ghz WiFi",4.1,29.99
"wansview Wireless Security Camera, IP Camera 1080P HD, WiFi Home Indoor Camera for Baby/Pet/Nanny, 2 Way Audio Night Vision, Works with Alexa, with TF Card Slot and Cloud",4.3,29.99
"GMK Security Camera Wireless Outdoor, 1080P Color Night Vision AI Motion Detection 2-Way Talk Battery Powered WiFi Home Indoor Camera IP65 Weatherproof Spotlight Siren Alarm Cloud/SD Storage",4.6,79.99
SimpliSafe Wireless Outdoor Security Camera,4.2,189.99
"","",
"",4 S,
"REOLINK Wireless Security Camera, E1 3MP HD Plug-in Indoor WiFi Camera for Home Security/Baby Monitor/ Pets, Micro SD Card Storage, Pan Tilt, Night Vision, Works with Alexa/Google Assistant",4.3,39.99
"YI Home Security Camera, 1080p 2.4G WiFi IP Indoor Surveillance Camera with Night Vision, Motion Detection, Phone App, Pet Cat Dog Cam Works with Alexa and Google Assistance",4.3,24.99
"REOLINK 4K Security Camera System, RLK16-800B8 8pcs H.265 4K PoE Security Cameras Wired with Person Vehicle Detection, 8MP/4K 16CH NVR with 4TB HDD for 24-7 Recording",4.5,799.99
"Arlo Essential Indoor Camera - 1080p Video with Privacy Shield, Plug-in, Night Vision, 2-Way Audio, Siren, Direct to WiFi No Hub Needed, Wireless Security, White - VMC2040",4.2,75.50
"GALAYOU 2K Light Bulb Security Cameras Wireless Outdoor, Lightbulb Camera,WiFi Cameras for Home Security, Smart Porch Camera Garage, Motion Tracking 360° Pan-Tilt View Alexa Google Home E27 Socket G6",4.4,35.99
"Security Camera Outdoor, 1080P HD Wireless Rechargeable Battery Powered WiFi Home Surveillance Camera with Waterproof, Night Vision, Motion Detection, 2-Way Audio and SD Storage",4.4,49.99
"JMDHKK Hidden Camera Detectors, Bug Detector ,Anti Spy Detector ,GPS Detector ,RF Signal Scanner Device Detector for GPS Tracker Listening Device Camera Finder",3.8,43.89
"TP-Link Tapo Pan/Tilt Security Camera for Baby Monitor, Pet Camera w/ Motion Detection, 1080P, 2-Way Audio, Night Vision, Cloud & SD Card Storage, Works with Alexa & Google Home (Tapo C200)",4.5,24.34
"REOLINK E1 Pro 4MP HD Plug-in Home Security Indoor Camera with 2.4/5 GHz Wi-Fi, Auto Tracking, Smart Person/Pet Detection, Multiple Storage Options, Ideal for Baby Monitor/ Pet Camera/Elderly",4.3,54.99
"AcuRite Iris (5-in-1) Indoor/Outdoor Wireless Weather Station for Indoor and Outdoor Temperature and Humidity, Wind Speed and Direction, and Rainfall with Digital Display (01512M)",4.5,150.00
"Wyze Cam Outdoor Starter Bundle v2 (Includes Base Station and 1 Cam), 1080p HD Indoor/Outdoor Wireless Smart Home Camera with Color Night Vision, 2-Way Audio, Works with Alexa & Google - 1 Camera Kit",4.1,79.98
"Arlo Pro 3 Floodlight Camera - Wireless Security, 2K Video & HDR, Color Night Vision, 2 Way Audio, Wire-Free, Direct to WiFi No Hub Needed, 160° View, Works with Alexa, White - FB1001",4.3,169.99
"GE Personal Security Window and Door Alarm, 4 Pack, DIY Protection, Burglar Alert, Wireless, Chime/Alarm, Easy Installation, Ideal for Home, Garage, Apartment and More, 45174",4.5,22.86
"YI Pan-Tilt Security Camera, 360 Degree 2.4G Smart Indoor Pet Dog Cat Cam with Night Vision, 2-Way Audio, Motion Detection, Phone APP, Compatible with Alexa and Google Assistant",4.2,33.99
"Imou Indoor Security Camera 1080p WiFi Camera (2.4G Only) 360 Degree Home Camera with App, Night Vision, 2-Way Audio, Human Detection, Motion Tracking, Sound Detection, Local & Cloud Storage",4.1,23.19
"Baby Monitor with Remote Pan-Tilt-Zoom Camera and 3.2'' LCD Screen, Infrared Night Vision (White with Black)",4.4,69.99
Driveway Alarm- 1/2 Mile Long Range Wireless Driveway Alarm Outdoor Weather Resistant Motion Sensor&Detector-DIY Security Alert-Monitor&Protect Outdoor/Indoor Property - 1 Receiver and 2 Sensors,4.4,42.99
"Arlo Pro 4 Spotlight Camera - 1 Pack - Wireless Security, 2K Video & HDR, Color Night Vision, 2 Way Audio, Wire-Free, Direct to WiFi No Hub Needed, White - VMC4050P",4.0,154.98
"TP-Link Tapo 2K Pan/Tilt Security Camera for Baby Monitor, Dog Camera w/ Motion Detection, 2-Way Audio, Siren, Night Vision, Cloud & SD Card Storage, Works with Alexa & Google Home, 2-Pack (C210P2)",4.4,54.99
"Uniden Bearcat BC125AT Handheld Scanner, 500-Alpha-Tagged Channels, Close Call Technology, PC Programable, Aviation, Marine, Railroad, NASCAR, Racing, and Non-Digital Police/Fire/Public Safety.",4.1,121.30
"REOLINK 4G LTE Cellular Security Camera Outdoor, Pan Tilt, Wireless Solar Powered, 2K HD Night Vision, 2-Way Talk, Smart Person/Vehicle Detection, No WiFi, Go PT Plus with Solar Panel -US Version",4.2,279.99
"Indoor Security Camera 2K, Pet Camera with Phone App, WiFi Cameras for Home Security Camera for Dog/ Baby Monitor/Elder Pan Tilt, 2.4G, 24/7, 2-Way Talk, Human Detection, Motion Tracking, SD&Cloud",4.6,29.98
"64GB Spy Camera Hidden Camera Pen Full HD 1080P Mini Spy Pen Camera Camcorder with Photo Taking,Nanny Cam Hidden Camera, Small Hidden Camera with Motion Detection for Business Meeting [2022 Version]",4.2,39.99
SimpliSafe Doorbell - Compatible with SimpliSafe Home Security System - Latest Gen,4.4,169.99
"","",
"",4 S,
"Amcrest 5MP Turret POE Camera, UltraHD Outdoor IP Camera POE with Mic/Audio, 5-Megapixel Security Surveillance Cameras, 98ft NightVision, 2.8mm Lens (103° FOV), IP67, MicroSD (256GB), (IP5M-T1179EW)",4.3,57.99
Spy Camera Charger - Hidden Camera - Premium Pack - HD 1080P - Best Mini Spy Camera - USB Charger Camera - Secret Camera - Nanny Cam - Small Cameras for Spying - Surveillance Camera Full HD,4.3,37.99
"LaView Security Cameras 4pcs, Home Security Camera Indoor 1080P, Wi-Fi Cameras Wired for Pet, Motion Detection, Two-Way Audio, Night Vision, Phone App, Works with Alexa, iOS & Android & Web Access",4.2,89.99
"KOSIN Safe Sound Personal Alarm, 6 Pack 140DB Personal Security Alarm Keychain with LED Lights, Emergency Safety Alarm for Women, Men, Children, Elderly",4.6,18.99
"DEKCO Outdoor Security Camera 1080p Pan Rotating 180° Wired WiFi Cameras for Home Security with Two-Way Audio, Night Vision, 2.4G WiFi, IP65, Motion Detection Alarm (2 Pack)",4.3,69.99
"nooie Baby Monitor, WiFi Pet Camera Indoor, 360-degree IP Camera, 1080P Home Security Camera, Motion Tracking, Super IR Night Vision, Works with Alexa, Two-Way Audio, Motion & Sound Detection",4.2,49.99
"NETVUE Indoor Camera, 1080P FHD 2.4GHz WiFi Pet Camera, Home Camera for Pet/Baby, Dog Camera 2-Way Audio, Indoor Security Camera Night Vision, AI Human Detection, Cloud Storage/TF Card, Black",4.2,23.99
EMDMAK Door Stop Alarm with 120DB Siren Door Stop for Home & Travel (Black) (Pack of 2),4.4,13.99
"HENDUN Wireless Door Alarm with Remote, Windows Open Alarms,Home Security Sensor, Pool Alarm for Kids Safety, Prevent Robbery (2 Pack)",4.4,23.99
"YI 2pc Security Camera Outdoor, 1080p Outside Surveillance Front Door IP Smart Cam with Waterproof, WiFi, Cloud, Night Vision, Motion Detection Sensor, Smartphone App, Works with Alexa",4.3,62.39
"REOLINK Home Security Camera System, 3MP HD Plug-in Indoor WiFi Camera, Pan Tilt Pet Camera, Baby Monitor, Night Vision, 2 Way Audio, Motion Alerts, Local SD Card Storage, E1(2 Pack)",4.3,63.74
"Logitech Circle View Apple HomeKit- enabled Wired Doorbell with Logitech TrueView Video, Face Recognition, Color Night Vision, and Head-to-toe HD Video",3.8,199.99
"All-New Blink Outdoor Camera Housing and Mounting Bracket, 3 Pack Protective Cover and 360 Degree Adjustable Mount with Blink Sync Module Outlet Mount for Blink Camera Security System (Black)",4.4,19.99
"BOAVISION Security Camera Outdoor, Wireless WiFi IP Camera Home Security System 360° View,Motion Detection, auto Tracking,Two Way Talk,HD 1080P pan Tile Full Color Night Vision",4.1,37.99
"REOLINK 4K PTZ Outdoor Camera, PoE IP Home Security Surveillance, 5X Optical Zoom Auto Tracking, 3pcs Spotlights Color Night Vision, Two Way Talk, Up to 256GB SD Card(Not Included), RLC-823A",4.4,227.27
"REOLINK 4K Security Camera Outdoor System, IP PoE Surveillance Camera with 5X Optical Zoom, Human/Vehicle Detection, Two Way Talk, Color Night Vision, Timelapse, Up to 256GB SD Card, RLC-811A",4.3,107.99
"ClODGDGO 64GB Spy Camera Hidden Camera Car Key,360 Minutes Battery Life Mini Spy Camera, Nanny Cam Hidden Camera with HD 1080P,Surveillance & Security Cameras for Dating",4.7,45.99
"REOLINK Indoor Security Camera, 5MP Super HD Plug-in WiFi Camera with Pan Tilt Zoom/ Motion Alerts, Ideal for Baby Monitor/ Pet Camera/Home Security, Dual Band WiFi, Multiple Storage Options, E1 Zoom",4.3,63.99
"WGV Security Camera -2K Cameras for Home Security with Smart Motion Dection, Night Vision, Two-Way Audio,Cloud & SD Card Storage,Work with Alexa, Ideal Indoor Camera for Baby Monitor/ Pet Camera",4.7,29.99
"REOLINK 4K 8Ch Network Video Recorder for Home Security Camera System, Work with 4K/5MP/4MP HD Reolink IP Cameras PoE NVR, 24/7 Recording to Pre-Installed 2TB Hard Drive, RLN8-410",4.3,233.98
"2K Security Camera Indoor, aosu Baby Monitor Pet Camera 360-Degree for Home Security, WiFi IP Cam with 5/2.4 GHz Wi-Fi, One-Touch Calls, Smart Motion Tracking, IR Night Vision, Compatible with Alexa",4.5,32.99
"REOLINK 4K Security Camera System, RLK16-800D8, 8pcs H.265 4K PoE Security Cameras Wired with Person Vehicle Detection, 8MP/4K 16CH NVR with 4TB HDD for 24-7 Recording",4.4,999.99
"Wireless Cameras for Home/Outdoor Security, Battery Powered 1080P HD WiFi Security Cameras Wireless Outdoor with Spotlight, AI Motion Detection, Siren, Color Night Vision, 2-Way Talk, SD/Cloud Storage",4.9,48.99
"Original Defense® Siren Self Defense for Women - Personal Alarm for Women, Children, & Elderly - Recommended by Police - 130 dB Loud Self Defense Keychain Siren with LED Strobe Light (Magenta)",4.4,19.99
"","",
"",4 S,
"REOLINK 4K Security Camera System, 4pcs H.265 4K PoE Security Cameras Wired with Person Vehicle Detection, 8MP/4K 8CH NVR with 2TB HDD for 24-7 Recording, RLK8-800B4",4.4,446.99
"Outlet Wall Mount for Blink Sync Module 2, Mount Bracket Holder for Blink Outdoor Camera No Messy Wires Outdoor and Indoor Home Security Camera Mount with Short Cable (1 Pack)…",4.7,9.99
Wyze Window Mount for Wyze Cam v3,4.4,9.98
"winees Baby Monitor, 1080P Indoor Camera with Audio and Night Vision, WiFi Surveillance Camera Security Home Dog Pet Monitor with App, PTZ, Motion Sensor Detection 2 Way Audio Alexa Camera",4.2,32.99
"REOLINK Solar WiFi Camera Security Outdoor, 100% Wire-Free, Wireless Battery Powered, 1080p, 2-Way Talk, Night Vision, PIR Motion Detection, Works with Alexa, Argus Eco with Solar Panel",4.1,89.99
SimpliSafe Entry Sensor - Window and Door Protection - Compatible with Gen 3 Home Security System,4.8,14.99
"Light Bulb Security Camera,Home WiFi 360 Degree Pan/Tilt Panoramic IP Camera,Wireless Home Surveillance Cameras System with Human Motion Detection and Alarm,Two-Way Audio,Night Vision",3.1,4.98
"Wireless Camera Mini Hidden Spy Camera Portable Small Nanny Cam Features with Body Pet HD 1080P Camera, Night Vision and Motion Detection for Home Outdoor Office.",2.8,18.99
"Dzees Outdoor Camera Wireless, Battery Powered WiFi Surveillance Camera for Home Security System with Siren Alarm & Spotlight, Motion Detection, Color Night Vision, IP65 Waterproof Cloud/SD-2-Pack",4.4,98.99
Datacolor SpyderX Pro – Monitor Calibration Designed for Serious Photographers and Designers - SXP100,4.4,144.53
Google Nest Cam Outdoor 2-Pack - 1st Generation - Weatherproof Outdoor Camera - Surveillance Camera with Night Vision - Control with Your Phone,4.6,369.00
"REOLINK Cameras for Home Security, 4MP HD Plug-in Security Camera Indoor Wireless, Auto Tracking, Smart Person/Pet Detection, Baby Monitor/Pet Camera, Home Cameras with App for Phone, E1 Pro (2 Pack)",4.3,83.19
SensorPush G1 WiFi/Ethernet Gateway. Receive Data/Alerts from Anywhere via Internet. No Monthly Fee. Unlimited History. Developed/Supported/Hosted in USA. iPhone/Android App/Web Dashboard/Alexa,4.6,99.95
"Nest NC2100ES Outdoor Security Camera, 3 MP, Weatherproof Camera, IP Rating IP65, Diagonal: 130°.",4.5,177.99
"Noorio B310 Outdoor Wireless Security Camera 2K Resolution, Battery Powered Camera for Home Security, Color Night Vision with Ultra-Bright Spotlight 16GB Local Storage Work with Alexa (No Magnetic)",4.1,119.99
Light Bulb 1080P Security—Wireless Camera Wifi Smart for home surveillance Screw into the E27 light bulb socket Spotlight Alarm Color night vision Two-way talk Motion Alarm PTZ 360 Degree(2packs）,3.6,45.99
"All-New Blink Outdoor Camera Wall Mount, 360° Adjustable Mount and Weather Proof Protective Housing with Blink Sync Module Outlet Mount for Blink Outdoor Security Camera System (Black, 5 Pack)",4.5,27.99
"Hidden Camera Detectors-Hidden Devices Spy Camera Bug RF Listening Device Car GPS Tracker Detector Wireless Signal Scanner Infrared Finder for Home Office Hotel Bathroom, Gifts for Women Men",4.4,49.99
"Zmodo Outdoor Wireless (2 Pack), 1080p Full HD Home Security Camera System, Works with Alexa and Google Assistant, White (ZM-W0002-2)",4.1,75.99
"Kasa Smart Video Doorbell Camera Hardwired w/ Chime, 3MP 2K Resolution, 2-Way Audio, Real-Time Notification, Cloud & SD Card Storage, Alexa & Google Assistant Compatible (KD110), White, Black",4.2,49.99
"WYZE Cam v3 Indoor/Outdoor Smart Security Camera, 1080p HD Camera, Color Night Vision, Two-Way Audio, Motion Detection for Baby Pet Monitor, Works with Alexa & Google Home",4.5,35.98
"4MP Indoor Security Camera, WUUK Pan Tilt Cam for Baby Monitor, Wi-Fi Home Security Pet Camera for Dog or Cat, Motion Detection & Tracking, Night Vision, 2-Way Audio, Compatible with Alexa & Google",4.3,39.99
"ANNKE 5MP Lite Security Camera System Outdoor with AI Human/Vehicle Detection, 8CH H.265+ DVR and 8 x 1920TVL 2MP IP66 Home CCTV Cameras, Smart Playback, Email Alert with Images, 1TB Hard Drive - E200",4.5,219.99
"HAWKRAY Wireless Outdoor Security Camera with Spotlight, 1080P Battery Powered WiFi Surveillance Cameras for Home Security System, Night Vision, Motion Detection, 2-Way-Talk, IP65 Weatherproof",4.3,42.99
"","",
"",4 S,
